{
  "$id": "urn:uuid:935b7210-c2f6-402c-90d2-ebe3e5ffffd2",
  "$schema": "https://json-schema.org/draft/2020-12/schema",
  "title": "Electrical Grid",
  "type": "object",
  "properties": {
    "Schema_UUID": {
      "const": "935b7210-c2f6-402c-90d2-ebe3e5ffffd2"
    },
    "Instance_UUID": {
      "description": "The unique identifier for this object. (A UUID specified by RFC4122).",
      "type": "string",
      "format": "uuid"
    },
    "Device_Information": {
      "$ref": "urn:uuid:2dd093e9-1450-44c5-be8c-c0d78e48219b"
    },
    "Regions": {
      "type": "object",
      "patternProperties": {
        "^[a-zA-Z0-9_]*$": {
          "$ref": "urn:uuid:a15a0500-88ee-4e56-af43-224a874ccf32"
        }
      }
    }
  },
  "required": [
    "Schema_UUID",
    "Instance_UUID"
  ]
}